name,url,rating,reviews_count,metro,address,map_url,hours,phone,description,pros,prices,photo_urls
"Коворкинг Ребус Пространство","https://kowo-space.ru/coworking/rebus-prostranstvo/","5","0","м. Маяковская (402 м), м. Пушкинская (521 м)Адрес: Трёхпрудный пер., 11/13с2Часы работы:Ежедневно 8:00–20:00","","https://yandex.ru/maps/org/rebus_prostranstvo/92692866512/","","+7 (995) 919-90-60","Ребус Пространство — это коворкинг, если вы фрилансер и ищете место для работы, вам здесь понравится. Просторное место для проведения семинаров, лекций и групповых занятий.Также есть синий кабинет, который идеально подходит для индивидуальных консультаций, занятий в мини-группах для психологов и деловых встреч. В нем есть два удобных кресла, диван, журнальный столик и кондиционер. Если вы хотите провести свое время в уютной обстановке, где есть все необходимое для работы, Ребус Пространство — отличный выбор! 🌟","","","https://kowo-space.ru/wp-content/uploads/2024/02/logo_png_full_black-e1708586918575-900x525-1.png ; https://kowo-space.ru/wp-content/uploads/2024/02/xxxl-1-24-1.webp ; https://kowo-space.ru/wp-content/uploads/2024/02/xxxl-2-22-1.webp ; https://kowo-space.ru/wp-content/uploads/2024/02/xxxl-3-22-1.webp ; https://kowo-space.ru/wp-content/uploads/2024/02/xxxl-4-16-1.webp ; https://kowo-space.ru/wp-content/uploads/2024/02/xxxl-5-11-1.webp ; https://kowo-space.ru/wp-content/uploads/2024/02/xxxl-33-1.webp ; https://kowo-space.ru/wp-content/uploads/2024/02/logo_png_full_black-e1708586918575-900x525-1-300x175.png ; https://kowo-space.ru/wp-content/themes/dochernyaya-tema/includes/assets/img/deworkacy.png ; https://kowo-space.ru/wp-content/uploads/2023/11/1-300x94.webp"
"Коворкинг Рекро","https://kowo-space.ru/coworking/rekro/","4.9","0","м. Шаболовская (749 м), м. Площадь Гагарина (1,4 км)Адрес:ул. Шухова, 17, корп. 2, этаж 3Часы работы:круглосуточно","","https://yandex.ru/maps/org/rekro/43430382372/","","+7 (495) 208-22-42","Рекро — уютный коворкинг в Москве, рядом с метро Шаболовская. Предлагает незакрепленные рабочие места, безлимитный интернет, доступ к принтеру и сканеру, а также бесплатные чай, кофе и воду. Доступные тарифы позволяют арендовать места на разовое посещение или на длительный срок, включая круглосуточный доступ для резидентов. | Плюсы: | Удобное расположение. | Круглосуточный доступ для резидентов. | Полный спектр офисных услуг. | Подходит для: | Фрилансеров. | Стартапов. | Малого бизнеса.","Удобное расположение. ; Круглосуточный доступ для резидентов. ; Полный спектр офисных услуг. ; Подходит для: ; Фрилансеров. ; Стартапов. ; Малого бизнеса. ; Рекро на карте Москвы — Яндекс Карты","","https://kowo-space.ru/wp-content/uploads/2024/01/1-ewpvjxck-2o19gpngj8ofcvw2tz8pcs-wnohgj77lxunsrs1c5vzuaccjfjstebp0au6_t.jpg ; https://kowo-space.ru/wp-content/uploads/2024/01/zagruzhennoe.jpeg ; https://kowo-space.ru/wp-content/uploads/2024/01/zagruzhennoe-1-300x300-1.jpeg ; https://kowo-space.ru/wp-content/uploads/2024/01/zagruzhennoe-2.jpeg ; https://kowo-space.ru/wp-content/uploads/2024/01/zagruzhennoe-3.jpeg ; https://kowo-space.ru/wp-content/uploads/2024/01/zagruzhennoe-4.jpeg ; https://kowo-space.ru/wp-content/uploads/2024/01/zagruzhennoe-5.jpeg ; https://kowo-space.ru/wp-content/themes/dochernyaya-tema/includes/assets/img/deworkacy.png ; https://kowo-space.ru/wp-content/uploads/2023/11/1-300x94.webp"
"Коворкинг Телеграф Алтуфьево","https://kowo-space.ru/places/telegraf-altufevo/","4.4","0","м. Селигерская (1,4 км), м. Отрадное (1,4 км)Адрес:Алтуфьевское шоссе, 35, стр. 1, 2 этажЧасы работы: ежедневно 9:00-21:00","","https://yandex.ru/maps/org/telegraf/40560515885/","","+7 (495) 280-00-08","Телеграф Алтуфьево — это современное пространство для работы и деловых встреч на Алтуфьевском шоссе, Москва. Здесь можно арендовать рабочие места, офисы, переговорные комнаты и конференц-залы. Центр предлагает гибкие условия аренды, комфортные рабочие зоны и все необходимые удобства, включая высокоскоростной Wi-Fi и офисное оборудование. | Для кого подходит: | Фрилансеры и удалённые сотрудники: для работы в удобном и современном пространстве. | Стартапы и малый бизнес: для аренды офисов и проведения встреч. | Бизнес-специалисты: для проведения переговоров и презентаций. | Коучи и тренеры: для проведения тренингов и мастер-классов. | Для каких ситуаций: | Ежедневная работа и удалённая занятость. | Деловые встречи и переговоры. | Тренинги и мастер-классы. | Презентации и семинары. | Плюсы: | Гибкие условия аренды: возможность почасовой и долгосрочной аренды. | Комфортные условия: современные рабочие зоны и офисы с необходимым оборудованием. | Дополнительные услуги: высокоскоростной Wi-Fi, офисное оборудование, уютные общие зоны и кухня.","Гибкие условия аренды: возможность почасовой и долгосрочной аренды. ; Комфортные условия: современные рабочие зоны и офисы с необходимым оборудованием. ; Дополнительные услуги: высокоскоростной Wi-Fi, офисное оборудование, уютные общие зоны и кухня. ; Телеграф на карте Москвы — Яндекс Карты","","https://kowo-space.ru/wp-content/uploads/2024/01/cropped-logotip-1.png.webp ; https://kowo-space.ru/wp-content/uploads/2024/01/bolshaja-peregovornaja-do-12-chel-pvbpl5iri5aofjrd4l0narfqyl7r6qokfh7lgh3fz4.jpg ; https://kowo-space.ru/wp-content/uploads/2024/01/obedennaja-zona-pvbpl9a49hftpzlwimn5kqhlc4p81j3hrztjdkxva8.jpg ; https://kowo-space.ru/wp-content/uploads/2024/01/open-speis-2-pvbplb5sn5ied7j67ngepq0iiwfygxayg94ic4v2xs.jpg ; https://kowo-space.ru/wp-content/uploads/2024/01/open-spjeis-1-pvbplb5sn5ied7j67ngepq0iiwfygxayg94ic4v2xs.jpg ; https://kowo-space.ru/wp-content/uploads/2024/01/peregovornaja-bol-pvbplc3mtzjootht25v1a7rz4abbomeosdrztetork.jpg ; https://kowo-space.ru/wp-content/uploads/2024/01/photo_2022-09-19_13-07-40-pvbplfuzlbotz9ccg7hjk6tthtssjetm4wdxqio42o.jpg ; https://kowo-space.ru/wp-content/uploads/2024/01/cropped-logotip-1.png-300x300.webp ; https://kowo-space.ru/wp-content/themes/dochernyaya-tema/includes/assets/img/deworkacy.png ; https://kowo-space.ru/wp-content/uploads/2023/11/1-300x94.webp"
"Коворкинг Телеграф Сущевский","https://kowo-space.ru/places/telegraf-sutshevskiy/","4.7","0","м. Савеловская (438 м), м. Марьина роща (444 м)Адрес:ул. Образцова, 31с3Часы работы: круглосутоно","","https://yandex.ru/maps/org/telegraf/195656725338/","","+7 (495) 280-00-08","Телеграф Сущевский — это современное пространство для работы и деловых встреч в Москве на Садовом кольце. Здесь можно арендовать рабочие места, офисы, переговорные комнаты, конференц-залы и тренинг-классы. Центр предлагает гибкие условия аренды, комфортные рабочие зоны и все необходимые удобства, включая высокоскоростной Wi-Fi и офисное оборудование. | Для кого подходит: | Фрилансеры и удалённые сотрудники: для работы в удобном и современном пространстве. | Стартапы и малый бизнес: для аренды офисов и проведения встреч. | Бизнес-специалисты: для проведения переговоров и презентаций. | Коучи и тренеры: для проведения тренингов и мастер-классов. | Для каких ситуаций: | Ежедневная работа и удалённая занятость. | Деловые встречи и переговоры. | Тренинги и мастер-классы. | Презентации и семинары. | Плюсы: | Удобное расположение: на Садовом кольце, рядом с метро Марьина Роща. | Гибкие условия аренды: возможность почасовой и долгосрочной аренды. | Комфортные условия: современные рабочие зоны и офисы с необходимым оборудованием. | Дополнительные услуги: высокоскоростной Wi-Fi, офисное оборудование, уютные общие зоны и кухня.","Удобное расположение: на Садовом кольце, рядом с метро Марьина Роща. ; Гибкие условия аренды: возможность почасовой и долгосрочной аренды. ; Комфортные условия: современные рабочие зоны и офисы с необходимым оборудованием. ; Дополнительные услуги: высокоскоростной Wi-Fi, офисное оборудование, уютные общие зоны и кухня. ; Телеграф на карте Москвы — Яндекс Карты","","https://kowo-space.ru/wp-content/uploads/2024/01/cropped-logotip-1.png-1.webp ; https://kowo-space.ru/wp-content/uploads/2024/01/telegraph2-10-of-54-pyws3lfqepeb26asvdqpf50l3ks55lmev3h6qnm2e8-1.jpg ; https://kowo-space.ru/wp-content/uploads/2024/01/telegraph2-12-of-54-pyws3mdkljflds9fpw5bzms1oynidaq5784o7xko80-1.jpg ; https://kowo-space.ru/wp-content/uploads/2024/01/telegraph2-21-of-54-pyws3mdkljflds9fpw5bzms1oynidaq5784o7xko80-1.jpg ; https://kowo-space.ru/wp-content/uploads/2024/01/telegraph2-25-of-54-pyws3nbesdgvpe82kejyk4jiacivkztvjcs5p7ja1s-1.jpg ; https://kowo-space.ru/wp-content/uploads/2024/01/telegraph2-28-of-54-pyws3o98z7i6106pewyl4mayvqe8soxlvhfn6hhvvk-1.jpg ; https://kowo-space.ru/wp-content/uploads/2024/01/telegraph2-32-of-54-pyws3o98z7i6106pewyl4mayvqe8soxlvhfn6hhvvk-1.jpg ; https://kowo-space.ru/wp-content/uploads/2024/01/telegraph-10-of-79-pyv77yuoecclimlcks7g8cmuz39y6domca5nvtnezk-1.jpg ; https://kowo-space.ru/wp-content/uploads/2024/01/telegraph-22-of-79-pyv77zsil6dvu8jzfam2suebkh5be2scoet5d3m0tc-1.jpg ; https://kowo-space.ru/wp-content/uploads/2024/01/telegraph-46-of-79-pyv780qcs0f65uim9t0pdc5s5v0olrw30jgmudkmn4-1.jpg ; https://kowo-space.ru/wp-content/uploads/2024/01/cropped-logotip-1.png-1-300x300.webp ; https://kowo-space.ru/wp-content/themes/dochernyaya-tema/includes/assets/img/deworkacy.png ; https://kowo-space.ru/wp-content/uploads/2023/11/1-300x94.webp"
"Коворкинг Технопарк Нагатино","https://kowo-space.ru/places/tehnopark-nagatino/","4.7","0","м. Нагатинская (329 м), м. Крымская (635 м)Адрес:Варшавское шоссе, 28А. Технопарк Нагатино, 6 этажЧасы работы: ежедневно 9:00-23:00","","https://yandex.ru/maps/org/tekhnopark_nagatino/1278635872/","","+7 (495) 478-70-08","Технопарк Нагатино — современное коворкинг-пространство, расположенное в 5 минутах от метро Нагатинская. Оно предлагает уютную атмосферу и отличную инфраструктуру, включая кухню, кафе, душевые, зоны отдыха и парковку на 200 мест. Здесь можно арендовать рабочие места по выгодным тарифам с возможностью оформления юридического адреса. Это идеальное место для эффективной работы, обмена опытом и успешного нетворкинга. | Плюсы: | Удобное расположение. | Развитая инфраструктура. | Гибкие тарифы аренды. | Подходит для: | Фрилансеров и стартапов. | Малого и среднего бизнеса. | Профессионалов, ценящих комфорт и функциональность.","Удобное расположение. ; Развитая инфраструктура. ; Гибкие тарифы аренды. ; Подходит для: ; Фрилансеров и стартапов. ; Малого и среднего бизнеса. ; Профессионалов, ценящих комфорт и функциональность. ; Технопарк Нагатино на карте Москвы — Яндекс Карты","","https://kowo-space.ru/wp-content/uploads/2024/01/xs-3.webp ; https://kowo-space.ru/wp-content/uploads/2024/01/dizayn-sovremennogo-.webp ; https://kowo-space.ru/wp-content/uploads/2024/01/dizayn-sovremennogo-1.webp ; https://kowo-space.ru/wp-content/uploads/2024/01/dizayn-sovremennogo-2-1.webp ; https://kowo-space.ru/wp-content/uploads/2024/01/dizayn-sovremennogo-3.webp ; https://kowo-space.ru/wp-content/uploads/2024/01/dizayn-sovremennogo-4.webp ; https://kowo-space.ru/wp-content/uploads/2024/01/dizayn-sovremennogo-5.webp ; https://kowo-space.ru/wp-content/uploads/2024/01/dizayn-sovremennogo-6.webp ; https://kowo-space.ru/wp-content/themes/dochernyaya-tema/includes/assets/img/deworkacy.png ; https://kowo-space.ru/wp-content/uploads/2023/11/1-300x94.webp"
"Коворкинг Точка","https://kowo-space.ru/coworking/kovorking-tochka/","4.6","0","м. Дубровка (761 м), м. Автозаводская (987 м)Адрес:1-я ул. Машиностроения, 10, 2 этажЧасы работы:ежедневно 9:00-21:00","","https://yandex.ru/maps/org/kovorking_tochka/106804200680/","","+7 (495) 120-53-00","Точка - это коворкинг, который предоставляет аренду рабочих мест. Вы можете снять место на день, неделю или месяц. Есть как фиксированные рабочие места, так и незакрепленные, чтобы каждый раз выбирать подходящее место. Данное место включает в себя некоторые удобства: безлимитный интернет, вода, чай, кофе, принтер и бумагу. Также есть переговорные комнаты, конференц-зал и офисы с необходимой инфраструктурой. 😊 | Тарифы: | Резидент на месяц: Вы получаете доступ к офису 24/7 с фиксированным рабочим местом и безлимитным интернетом. В вашем распоряжении вода, чай и кофе, а также принтер с бумагой. В составе услуг также включен IT-администратор и личный шкаф для ваших вещей. Вы получаете 5 часов переговорной комнаты в месяц, а также ежемесячные консультации юриста и бухгалтера. Вы будете в курсе анонсов проектов резидентов и получите скидки на мероприятия партнеров. Для вашего удобства предоставляется секретарская поддержка на мероприятиях и переговорах, а также возможность приема корреспонденции. | Резидент Эксклюзив месяц: Вы получаете доступ к офису 24/7 с фиксированным рабочим местом и безлимитным интернетом. В вашем распоряжении вода, чай и кофе, а также принтер с бумагой. В составе услуг также включен IT-администратор и личный шкаф для ваших вещей. Вы получаете 10 часов переговорной комнаты в месяц, а также три раза в месяц консультации юриста и бухгалтера. Вы будете в курсе анонсов проектов резидентов и получите скидки на мероприятия партнеров. Для вашего удобства предоставляется секретарская поддержка на мероприятиях и переговорах, а также возможность приема корреспонденции. Вы также получаете скидку 30% на аренду конференц-зала. | SMART Office:Вы получаете доступ к офису 24/7 с изолированным офисом, оборудованным безлимитным интернетом. В вашем распоряжении вода, чай и кофе. Для вашего удобства предоставляется оргтехника, включая принтер и сканер, а также IT-администратор для помощи с техническими вопросами. Вам предоставляется 5 часов переговорной комнаты в месяц.Стоит отметить, что вы получаете ежемесячные консультации юриста и бухгалтера. Вы будете в курсе анонсов проектов как для партнеров, так и для резидентов. Вас ждут скидки на мероприятия партнеров. Предоставляется услуга приема корреспонденции и предоставление юридического адреса при оплате за 6 месяцев.Также для вашего удобства предоставляются услуги секретаря.","","","https://kowo-space.ru/wp-content/uploads/2024/01/jfkjk54wzy8.jpg ; https://kowo-space.ru/wp-content/uploads/2024/01/1.jpg ; https://kowo-space.ru/wp-content/uploads/2024/01/1-1.jpg ; https://kowo-space.ru/wp-content/uploads/2024/01/2.jpg ; https://kowo-space.ru/wp-content/uploads/2024/01/2-1.jpg ; https://kowo-space.ru/wp-content/uploads/2024/01/3-1.jpg ; https://kowo-space.ru/wp-content/uploads/2024/01/4.jpg ; https://kowo-space.ru/wp-content/uploads/2024/01/4-1.jpg ; https://kowo-space.ru/wp-content/uploads/2024/01/5.jpg ; https://kowo-space.ru/wp-content/uploads/2024/01/6.jpg ; https://kowo-space.ru/wp-content/uploads/2024/01/jfkjk54wzy8-300x300.jpg ; https://kowo-space.ru/wp-content/themes/dochernyaya-tema/includes/assets/img/deworkacy.png ; https://kowo-space.ru/wp-content/uploads/2023/11/1-300x94.webp"
"Коворкинг Циферблат","https://kowo-space.ru/places/cziferblat/","5","0","м. Кузнецкий мост (176 м), м. Чеховская (214 м)Адрес:ул. Кузнецкий мост, 19, стр.1Часы работы: круглосуточно","","https://yandex.ru/maps/org/tsiferblat/120178389371/","","+7 (962) 964 67 86","Циферблат — это атмосферное место, где вы можете провести время с друзьями, поработать в спокойной обстановке или поучаствовать в различных мероприятиях, таких как киновечера, шахматные турниры и психологические консультации. Для фрилансеров это отличное место для работы. Вы найдете спокойную обстановку, уютные уголки и возможность поработать с ноутбуком. Также антикафе предлагает разнообразные напитки, включая кофе, латте и эспрессо.😊","","","https://kowo-space.ru/wp-content/uploads/2023/11/cz1.png ; https://kowo-space.ru/wp-content/uploads/2023/11/logo-1-615x900-1.png ; https://kowo-space.ru/wp-content/uploads/2023/11/xxxl-1-55.webp ; https://kowo-space.ru/wp-content/uploads/2023/11/xxxl-2-58.webp ; https://kowo-space.ru/wp-content/uploads/2023/11/xxxl-3-54.webp ; https://kowo-space.ru/wp-content/uploads/2023/11/xxxl-130.webp ; https://kowo-space.ru/wp-content/uploads/2023/11/a.webp ; https://kowo-space.ru/wp-content/uploads/2023/11/logo-1-615x900-1-205x300.png ; https://kowo-space.ru/wp-content/themes/dochernyaya-tema/includes/assets/img/deworkacy.png ; https://kowo-space.ru/wp-content/uploads/2023/11/1-300x94.webp"
"Коворкинг Штаб-квартира","https://kowo-space.ru/places/shtab-kvartira/","4.7","0","м. Сокольники (786 м), м. Бауманская (1,2 км)Адрес:ул. Бакунинская, 73, стр. 2, подъезд 5, этаж 5Часы работы: 09:00–20:00, по выходным вход при бронировании на неделю","","https://yandex.ru/maps/org/shtab_kvartira/138778816557/","","+7 (936) 254-70-09","Штаб-квартира - это пространство предназначено для фрилансеров и всех, кто ищет удобное место для работы. Внутри вы найдете кофе-бар с чаем, кофе и водой, а также открытую веранду. Скоростной интернет обеспечивает комфортное онлайн-присутствие.🌟 | Тарифы: | Незакрепленное рабочее место: Предоставляется скоростной интернет (300 Мбит/с) и кофе-бар с чаем, кофе и водой. Создана рабочая зона и зона отдыха на свежем воздухе. Для удобства доступна аренда оборудования за дополнительную плату. | Закрепленное рабочее место: Предоставляется скоростной интернет (300 Мбит/с) и кофе-бар с чаем, кофе и водой. Есть рабочая зона и зона отдыха на свежем воздухе. Доступна аренда оборудования. Также можно выкупить парковочное место за 6 000 руб./мес.","","","https://kowo-space.ru/wp-content/uploads/2023/11/photo_2022-06-29_14-22-25-1.jpg ; https://kowo-space.ru/wp-content/uploads/2023/11/l-1-5.webp ; https://kowo-space.ru/wp-content/uploads/2023/11/l-2-5.webp ; https://kowo-space.ru/wp-content/uploads/2023/11/l-3-4.webp ; https://kowo-space.ru/wp-content/uploads/2023/11/l-4-4.webp ; https://kowo-space.ru/wp-content/uploads/2023/11/l-12.webp ; https://kowo-space.ru/wp-content/uploads/2023/11/xxxl-16-1.webp ; https://kowo-space.ru/wp-content/uploads/2023/11/xxxl-17-1.webp ; https://kowo-space.ru/wp-content/uploads/2023/11/xxxl-18-1.webp ; https://kowo-space.ru/wp-content/uploads/2023/11/xxxl-19-1.webp ; https://kowo-space.ru/wp-content/uploads/2023/11/xxxl-20-1.webp ; https://kowo-space.ru/wp-content/uploads/2023/11/photo_2022-06-29_14-22-25-1-300x300.jpg ; https://kowo-space.ru/wp-content/themes/dochernyaya-tema/includes/assets/img/deworkacy.png ; https://kowo-space.ru/wp-content/uploads/2023/11/1-300x94.webp"
