name,url,rating,reviews_count,metro,address,map_url,hours,phone,description,pros,prices,photo_urls
"Коворкинг PLATFORMA#1","https://kowo-space.ru/coworking/platforma1/","5","0","м. Шоссе Энтузиастов (791 м), м. Андроновка (1,3 км)Адрес:Электродная улица, 2с34Часы работы:круглосуточно","","https://yandex.ru/maps/org/platforma_1/48204677606/","","+7 (495) 663-52-03","PLATFORMA#1 — это коворкинг, который предлагает различные тарифы: от разового посещения до аренды смарт-офисов на длительный срок. Включает рабочие места, переговорные комнаты, конференц-зал, доступ к офисной технике, высокоскоростной интернет и дополнительные услуги, такие как юридический адрес и секретарь. Идеально подходит для фрилансеров, стартапов и малых бизнесов. | Плюсы: | Удобное расположение. | Разнообразие тарифов и рабочих пространств. | Полный спектр офисных услуг. | Подходит для: | Фрилансеров. | Стартапов. | Малых бизнесов.","Удобное расположение. ; Разнообразие тарифов и рабочих пространств. ; Полный спектр офисных услуг. ; Подходит для: ; Фрилансеров. ; Стартапов. ; Малых бизнесов. ; Platforma 1 на карте Москвы — Яндекс Карты","","https://kowo-space.ru/wp-content/uploads/2023/11/qdnerjkn4lg-1-1.jpg ; https://kowo-space.ru/wp-content/uploads/2023/11/img-20200615-wa0150_440x300_dee-1-1.jpg ; https://kowo-space.ru/wp-content/uploads/2023/11/img-20200615-wa0154_440x300_dee-1-1.jpg ; https://kowo-space.ru/wp-content/uploads/2023/11/platforma1-1.webp ; https://kowo-space.ru/wp-content/uploads/2023/11/slide04-1.jpg ; https://kowo-space.ru/wp-content/uploads/2023/11/slide11_440x300_dee-1-1.jpg ; https://kowo-space.ru/wp-content/uploads/2023/11/qdnerjkn4lg-1-1-300x300.jpg ; https://kowo-space.ru/wp-content/themes/dochernyaya-tema/includes/assets/img/deworkacy.png ; https://kowo-space.ru/wp-content/uploads/2023/11/1-300x94.webp"
"Коворкинг Re: Work","https://kowo-space.ru/places/re-work/","4.6","0","м. Петровский парк (837 м), м. Менделеевская (1,1 км)Адрес:ул. Правды, 24, стр. 2, 2 этажЧасы работы: ежедневно 9:30-21:30","","https://yandex.ru/maps/org/re_work/125643469919/","","+7 (999) 832-59-53","Re: Work - это коворкинг тихий и удобный с хорошим расположением. Также интернет, шумоизоляционные переговорки и дружелюбный персонал делают его привлекательным для фрилансеров.😊","","","https://kowo-space.ru/wp-content/uploads/2024/01/2024-04-03_18-24.png ; https://kowo-space.ru/wp-content/uploads/2024/01/90rm.jpg ; https://kowo-space.ru/wp-content/uploads/2024/01/img_0025.jpg ; https://kowo-space.ru/wp-content/uploads/2024/01/l-1.webp ; https://kowo-space.ru/wp-content/uploads/2024/01/l-2.webp ; https://kowo-space.ru/wp-content/uploads/2024/01/l-3.webp ; https://kowo-space.ru/wp-content/uploads/2024/01/l.webp ; https://kowo-space.ru/wp-content/uploads/2024/01/perroom.jpg ; https://kowo-space.ru/wp-content/uploads/2024/01/2024-04-03_18-24-300x248.png ; https://kowo-space.ru/wp-content/themes/dochernyaya-tema/includes/assets/img/deworkacy.png ; https://kowo-space.ru/wp-content/uploads/2023/11/1-300x94.webp"
"Коворкинг Sk Plaza","https://kowo-space.ru/coworking/sk-plaza/","4.4","0","","Дмитровское шоссе, 163А, корп. 2. БЦ Sk PlazaЧасы работы:ежедневно 09:00-21:00+7 925 242-95-27","https://yandex.ru/maps/org/sk_plaza/46266684789/","","+7 (925) 242-95-27","SK Plaza - это современное пространство на 2-м этаже БЦ SK Plaza, рассчитанное на 140 рабочих мест. В нем вы найдете все необходимое для комфортной работы, а также возможность отдохнуть между задачами. 🌟 | Тарифы: | Гостевой: Включает Wi-fi, МФУ и чай/кофе. | Переменный: Включает Wi-fi, МФУ и чай/кофе. | Постоянный: Включает Wi-fi, МФУ, чай/кофе и закрепленное место.","","","https://kowo-space.ru/wp-content/uploads/2024/01/image-35.png ; https://kowo-space.ru/wp-content/uploads/2024/01/bfhcsr2iqc4bhzv28iwws0vj23f3qxys.jpg ; https://kowo-space.ru/wp-content/uploads/2024/01/gff1pmewr93j3yddxqqbp13hosz2zbfv.jpg ; https://kowo-space.ru/wp-content/uploads/2024/01/q6stud5ohnig94r4cpbfekoan7lz26kn.jpg ; https://kowo-space.ru/wp-content/uploads/2024/01/sehca8144zloa7io0tcbcai41p2jp6kv.jpg ; https://kowo-space.ru/wp-content/themes/dochernyaya-tema/includes/assets/img/deworkacy.png ; https://kowo-space.ru/wp-content/uploads/2023/11/1-300x94.webp"
"Коворкинг Smart Yard","https://kowo-space.ru/coworking/smart-yard/","5","0","м. Бауманская (475 м), м. Красносельская (947 м)Адрес:Спартаковская площадь, 16/15с6Часы работы:круглосуточно","","https://yandex.ru/maps/org/smart_yard/171554911255/","","+7 (495) 141-18-34","Smart Yard - это пространство предназначено для фрилансеров и бизнес-профессионалов, которые ищут удобное место для работы и общения. 😊 | Тарифы: | ТАРИФ ДЕНЬ: Вы получаете рабочее место в открытом пространстве с высокоскоростным интернетом и доступом с 09:00 до 21:00. Ежедневная уборка, карточная система доступа и административная поддержка включены. Принтер/сканер доступен для цветной печати форматов А4 и А3. Также есть кухонные уголки, кофе-споты и зоны отдыха. | ТАРИФ МЕСЯЦ: Вы получаете закрепленное рабочее место с высокоскоростным интернетом и доступом 24/7. Ежедневная уборка, карточная система доступа и административная поддержка обеспечивают комфорт и безопасность. Вам предоставляются бесплатные часы в переговорных комнатах. Принтер/сканер доступен для цветной печати форматов А4 и А3. Также есть кухонные уголки, кофе-споты и зоны отдыха | АРЕНДА ОФИСА ОТ 2 ЧЕЛОВЕК:Вы получаете умные столы с встроенной беспроводной зарядкой и комфортные кресла ""Profim"" с поддержкой поясницы. Доступен высокоскоростной интернет и доступ к офису 24/7. Каждый день проводится уборка помещений. Используется карточная система доступа и предоставляется административная поддержка. Вам предоставляются бесплатные часы в переговорных комнатах. Принтер/сканер доступен для цветной печати форматов А4 и А3. Также имеются кухни, кофе-споты и зоны отдыха.*(Стоимость указана за одного человека.)","","","https://kowo-space.ru/wp-content/uploads/2023/11/2024-04-03_17-59.png ; https://kowo-space.ru/wp-content/uploads/2023/11/l-1-7.webp ; https://kowo-space.ru/wp-content/uploads/2023/11/l-2-7.webp ; https://kowo-space.ru/wp-content/uploads/2023/11/l-3-6.webp ; https://kowo-space.ru/wp-content/uploads/2023/11/l-4-6.webp ; https://kowo-space.ru/wp-content/uploads/2023/11/l-5-4.webp ; https://kowo-space.ru/wp-content/uploads/2023/11/l-6-3.webp ; https://kowo-space.ru/wp-content/uploads/2023/11/l-7-2.webp ; https://kowo-space.ru/wp-content/uploads/2023/11/l-14.webp ; https://kowo-space.ru/wp-content/uploads/2023/11/num4.png-1.webp ; https://kowo-space.ru/wp-content/uploads/2023/11/per1-1.jpg-1.webp ; https://kowo-space.ru/wp-content/uploads/2023/11/workplace1.png-1.webp ; https://kowo-space.ru/wp-content/uploads/2023/11/workplace2.png-1.webp ; https://kowo-space.ru/wp-content/uploads/2023/11/xxxl-22-1.webp ; https://kowo-space.ru/wp-content/uploads/2023/11/2024-04-03_17-59-300x272.png ; https://kowo-space.ru/wp-content/themes/dochernyaya-tema/includes/assets/img/deworkacy.png ; https://kowo-space.ru/wp-content/uploads/2023/11/1-300x94.webp"
"Коворкинг SOK – Земляной Вал","https://kowo-space.ru/coworking/sok-zemlyanoj-val/","4.7","0","м. Чистые пруды (347 м), м. Сретенский бульвар (423 м)Адрес:ул. Земляной Вал, 8Часы работы:Ежедневно 9:00–19:00","","https://yandex.ru/maps/org/sok/88909334133/","","+7 (499) 302-29-96","SOK — это современное рабочее пространство с панорамным видом на Садовое кольцо. Это первый коворкинг SOK в Москве, предлагающий комфортные рабочие места в стиле лофт, оборудованные всем необходимым для продуктивной работы. Здесь есть разные типы офисов: от стандартизированных для небольших команд до премиальных с экологическим и акустическим комфортом. Также доступны переговорные комнаты разного уровня, оснащенные современным оборудованием. Пространство расположено в пешей доступности от ТРК «Атриум», что обеспечивает удобное транспортное сообщение и развитую инфраструктуру.","","","https://kowo-space.ru/wp-content/uploads/2024/02/sdu_kgvwdvc-e1708524461914-900x659-1.jpg ; https://kowo-space.ru/wp-content/uploads/2024/02/pl79r372o3cbu21swwrep16tkdkl5ah2-1.jpg ; https://kowo-space.ru/wp-content/uploads/2024/02/mhpzpkp7x1zyvy0e3187mgy8vlz7ljpf-1.jpg ; https://kowo-space.ru/wp-content/uploads/2024/02/k3cpenlh3usjlihsug1k2xllscv36l4w-1.jpg ; https://kowo-space.ru/wp-content/uploads/2024/02/jhg4u6ilrxrt8s13if8g4qnwaed08e5e-1.jpg ; https://kowo-space.ru/wp-content/uploads/2024/02/euzb3gj2m812zfdehjwmkzra47iqy2qc-1.jpg ; https://kowo-space.ru/wp-content/uploads/2024/02/e5ibbp5yezbeh75rfuds9zuoy4icotvo-1-1.jpg ; https://kowo-space.ru/wp-content/uploads/2024/02/apulluhrctc4tpwn99q1nsmw844agur6-1.jpg ; https://kowo-space.ru/wp-content/uploads/2024/02/sdu_kgvwdvc-e1708524461914-900x659-1-300x220.jpg ; https://kowo-space.ru/wp-content/themes/dochernyaya-tema/includes/assets/img/deworkacy.png ; https://kowo-space.ru/wp-content/uploads/2023/11/1-300x94.webp"
"Коворкинг SOK – Рыбаков Тауэр","https://kowo-space.ru/coworking/sok-leningradskij-prospekt-3/","5","0","м. Петровский парк (291 м), м. Динамо (508 м)Адрес: Ленинградский просп., 36, стр. 11 Часы работы:Ежедневно 9:00–18:00","","https://yandex.ru/maps/org/sok/22069749926/","","+7 (499) 302-29-96","SOK — это современное коворкинг-пространство для работы и деловых встреч в Москве. Здесь можно арендовать рабочие места, офисы и переговорные комнаты. Пространство предлагает гибкие условия аренды, комфортные рабочие зоны и все необходимые удобства, включая высокоскоростной Wi-Fi и офисное оборудование. | Для кого подходит: | Фрилансеры и удалённые сотрудники: для продуктивной работы в комфортной обстановке.Стартапы и малый бизнес: для аренды офисов и организации встреч.Бизнес-специалисты: для проведения переговоров и презентаций.Коучи и тренеры: для организации тренингов и мастер-классов. | Плюсы: | Удобное расположение: в Москве, в шаговой доступности от метро.Гибкие условия аренды: возможность аренды на час, день или более длительный срок.Комфортные условия: современные рабочие зоны и офисы с необходимым оборудованием.Дополнительные услуги: высокоскоростной Wi-Fi, офисное оборудование, уютные зоны для отдыха и кухня.","Удобное расположение: в Москве, в шаговой доступности от метро.Гибкие условия аренды: возможность аренды на час, день или более длительный срок.Комфортные условия: современные рабочие зоны и офисы с необходимым оборудованием.Дополнительные услуги: высокоскоростной Wi-Fi, офисное оборудование, уютные зоны для отдыха и кухня. ; SOK на карте Москвы — Яндекс Карты","","https://kowo-space.ru/wp-content/uploads/2024/02/sdu_kgvwdvc-e1708524461914-900x659-1.jpg ; https://kowo-space.ru/wp-content/uploads/2024/02/4nq455v2bipmd7cgnvasefk47bg9tte5-1.jpg ; https://kowo-space.ru/wp-content/uploads/2024/02/bt8vyctkw4ugaml64k0opjy2ney3vymg-1.jpg ; https://kowo-space.ru/wp-content/uploads/2024/02/hln283jilktra4fkd1gd2x270bgilbwj-1.jpg ; https://kowo-space.ru/wp-content/uploads/2024/02/o6ml1moe1sod9744g77rhof5evfxv8yg-1.jpg ; https://kowo-space.ru/wp-content/uploads/2024/02/okpo38mi6bd7cmledd958o55cool634a-1.jpg ; https://kowo-space.ru/wp-content/uploads/2024/02/vi1a3dobpc4i1qptrj9jfafc1a2t4i9q-1.jpg ; https://kowo-space.ru/wp-content/uploads/2024/02/sdu_kgvwdvc-e1708524461914-900x659-1-300x220.jpg ; https://kowo-space.ru/wp-content/themes/dochernyaya-tema/includes/assets/img/deworkacy.png ; https://kowo-space.ru/wp-content/uploads/2023/11/1-300x94.webp"
"Коворкинг SOK – Сады Пекина","https://kowo-space.ru/coworking/sok-leningradskij-prospekt/","4.7","0","м. Маяковская (295 м), м. Белорусская (846 м)Адрес:Большая Садовая ул., 5, корп. 1Часы работы:пн-пт 9:00-18:00 сб-вс выходной","","https://yandex.ru/maps/org/sok/212198193615/","","+7 (499) 302-29-96","SOK — это стильное и современное рабочее пространство, расположенное в самом сердце Москвы. Оно отличается продуманным интерьером и комфортной обстановкой, идеально подходящей для продуктивной работы. В коворкинге предлагаются разнообразные офисы и переговорные комнаты, оснащенные всем необходимым оборудованием. Пространство находится на Большой Садовой улице, что обеспечивает удобный доступ и развитую инфраструктуру. Коворкинг SOK Сады Пекина предоставляет высококачественный сервис и отличные условия для работы и проведения деловых встреч​.","","","https://kowo-space.ru/wp-content/uploads/2024/02/sdu_kgvwdvc-e1708524461914-900x659-1.jpg ; https://kowo-space.ru/wp-content/uploads/2024/02/e6j0kc2l73iw3dnlz88r7xil4eed40q8-1.jpg ; https://kowo-space.ru/wp-content/uploads/2024/02/gz9uki1xphgk7nafxv9vl1luf6i3r6gp-1.png ; https://kowo-space.ru/wp-content/uploads/2024/02/l3v6l1u53oivw933uia1k1lp3g75r359-1.jpg ; https://kowo-space.ru/wp-content/uploads/2024/02/s2duiixcqe8zpxleo80t8lhu9szktp16-1.jpg ; https://kowo-space.ru/wp-content/uploads/2024/02/wi8tzddwi47dw23c5oepvjyipty224s2-1.jpg ; https://kowo-space.ru/wp-content/uploads/2024/02/9rfdiuxg8ve0qbtuzwqaz5o2x6180qid-1.jpg ; https://kowo-space.ru/wp-content/uploads/2024/02/sdu_kgvwdvc-e1708524461914-900x659-1-300x220.jpg ; https://kowo-space.ru/wp-content/themes/dochernyaya-tema/includes/assets/img/deworkacy.png ; https://kowo-space.ru/wp-content/uploads/2023/11/1-300x94.webp"
"Коворкинг Sreda","https://kowo-space.ru/coworking/sreda-2/","4.3","0","м. Шелепиха (665 м), м. Международная (729 м)Адрес:Пресненская набережная, 12, этаж 19, 20Часы работы:пн-пт 09:00-21:00","","https://yandex.ru/maps/org/sreda/80116212795/","","+7 (495) 118-39-37","Sreda — это коворкинг, который предлагает рабочие места в опен-спейс и отдельные офисы с панорамным видом на город. Пространство включает переговорные комнаты, залы для мероприятий, скайп-румы и лаунж-зоны. Для резидентов доступны высокоскоростной интернет, офисная техника, кофе-поинт и круглосуточный доступ. Идеально подходит для фрилансеров, стартапов и малых бизнесов, ценящих комфорт и современные условия работы. | Плюсы: | Престижное расположение. | Панорамные виды. | Полный спектр офисных услуг. | Подходит для: | Фрилансеров. | Стартапов. | Малых бизнесов.","Престижное расположение. ; Панорамные виды. ; Полный спектр офисных услуг. ; Подходит для: ; Фрилансеров. ; Стартапов. ; Малых бизнесов. ; Sreda на карте Москвы — Яндекс Карты","","https://kowo-space.ru/wp-content/uploads/2024/01/sreda-200x200-1.webp ; https://kowo-space.ru/wp-content/uploads/2024/01/sreda-103.webp ; https://kowo-space.ru/wp-content/uploads/2024/01/sreda-121.webp ; https://kowo-space.ru/wp-content/uploads/2024/01/sreda-242.webp ; https://kowo-space.ru/wp-content/uploads/2024/01/sreda-263.webp ; https://kowo-space.ru/wp-content/uploads/2024/01/sreda-315-1.webp ; https://kowo-space.ru/wp-content/uploads/2024/01/sreda-351.webp ; https://kowo-space.ru/wp-content/themes/dochernyaya-tema/includes/assets/img/deworkacy.png ; https://kowo-space.ru/wp-content/uploads/2023/11/1-300x94.webp"
"Коворкинг Start Hub","https://kowo-space.ru/coworking/start-hub/","4.7","0","м. Дмитровская (537 м), м. Тимирязевская (1,3 км)Адрес:Большая Новодмитровская улица, 36с12, вход 6Часы работы:ежедневно 10:00–20:00, для резидентов — круглосуточно","","https://yandex.ru/maps/org/start_hub/1315161333/","","+7 (499) 325-33-26","Start Hub - это коворкинг расположенный на территории дизайн-завода «Флакон» в Москве, предлагает современные рабочие пространства для фрилансеров, стартапов и небольших команд. Здесь можно арендовать как незакрепленные рабочие места, так и отдельные кабинеты.Преимущества Start Hub включают высокоскоростной интернет, полностью оборудованную кухню с кофемашиной, микроволновкой и холодильником, а также переговорные комнаты вместимостью от 4 до 15 человек, оснащенные всей необходимой техникой. Рабочие места можно арендовать на день, неделю или месяц с различными тарифами, начиная от 600 рублей в день и до 13 000 рублей в месяц за закрепленное место​​. | Коворкинг также известен своим удобным расположением и комфортными условиями, что делает его отличным выбором для тех, кто ищет профессиональную и вдохновляющую рабочую среду.","","","https://kowo-space.ru/wp-content/uploads/2023/11/qxdzckc-u1o-900x636-1.jpg ; https://kowo-space.ru/wp-content/uploads/2023/11/start-hab-1.webp ; https://kowo-space.ru/wp-content/uploads/2023/11/xxxl-1-47.webp ; https://kowo-space.ru/wp-content/uploads/2023/11/xxxl-2-51.webp ; https://kowo-space.ru/wp-content/uploads/2023/11/xxxl-3-47.webp ; https://kowo-space.ru/wp-content/uploads/2023/11/xxxl-4-41.webp ; https://kowo-space.ru/wp-content/uploads/2023/11/xxxl-5-32.webp ; https://kowo-space.ru/wp-content/uploads/2023/11/xxxl-6-25.webp ; https://kowo-space.ru/wp-content/uploads/2023/11/xxxl-7-15.webp ; https://kowo-space.ru/wp-content/uploads/2023/11/xxxl-121.webp ; https://kowo-space.ru/wp-content/uploads/2023/11/xxxl-54-1.webp ; https://kowo-space.ru/wp-content/uploads/2023/11/qxdzckc-u1o-900x636-1-300x212.jpg ; https://kowo-space.ru/wp-content/themes/dochernyaya-tema/includes/assets/img/deworkacy.png ; https://kowo-space.ru/wp-content/uploads/2023/11/1-300x94.webp"
