name,url,rating,reviews_count,metro,address,map_url,hours,phone,description,pros,prices,photo_urls
"Антикафе и коворкинг Белый лист","https://kowo-space.ru/places/belyj-list/","4.9","0","м. Добрынинская (228 м), м. Павелецкая (628 м)Адрес:ул. Валовая 32/75Часы работы: ежедневно 10:00–23:00","","https://yandex.ru/maps/org/bely_list/1421522637/","","+7 (964) 566-33-35","Ещё фото7 | “Белый лист”  - это уютное пространство предлагает интересные возможности для фрилансеров и всех, кто хочет поработать или провести время в приятной атмосфере. В этом пространстве есть мощный Wi-Fi корпоративного уровня, множество розеток, удлинителей, зарядки для телефонов, флипчарты и возможности для отдыха (настольные игры, книги, гитара, укулеле и прочее).🌟","","","https://kowo-space.ru/wp-content/uploads/2023/11/screenshot_1-2.png ; https://kowo-space.ru/wp-content/uploads/2023/11/screenshot_2-1.png ; https://kowo-space.ru/wp-content/uploads/2023/11/screenshot_3-1.png ; https://kowo-space.ru/wp-content/uploads/2023/11/screenshot_4-1.png ; https://kowo-space.ru/wp-content/uploads/2023/11/screenshot_5-1.png ; https://kowo-space.ru/wp-content/uploads/2023/11/screenshot_6-1.png ; https://kowo-space.ru/wp-content/uploads/2023/11/screenshot_7-1.png ; https://kowo-space.ru/wp-content/uploads/2023/11/screenshot_8-1.png ; https://kowo-space.ru/wp-content/uploads/2023/11/screenshot_9-1.png ; https://kowo-space.ru/wp-content/uploads/2023/11/screenshot_10-1.png ; https://kowo-space.ru/wp-content/uploads/2023/11/photo_2022-08-10_14-58-03.jpg ; https://kowo-space.ru/wp-content/uploads/2023/11/xxxl-1-53.webp ; https://kowo-space.ru/wp-content/uploads/2023/11/xxxl-2-56.webp ; https://kowo-space.ru/wp-content/uploads/2023/11/xxxl-3-52.webp ; https://kowo-space.ru/wp-content/uploads/2023/11/xxxl-4-46.webp ; https://kowo-space.ru/wp-content/uploads/2023/11/xxxl-128.webp ; https://kowo-space.ru/wp-content/uploads/2023/11/photo_2022-08-10_14-58-03-300x300.jpg ; https://kowo-space.ru/wp-content/themes/dochernyaya-tema/includes/assets/img/deworkacy.png ; https://kowo-space.ru/wp-content/uploads/2023/11/1-300x94.webp"
"Антикафе и коворкинг Checkpoint","https://kowo-space.ru/places/checkpoint/","4.8","0","м. Трубная (396 м), м. Цветной бульвар (630 м)Адрес:ул. Мясницкая, 17, стр.2Часы работы: ежедневно круглосуточно","","https://yandex.ru/maps/org/checkpoint/1206703930/","","+7 (925) 394-27-75","Антикафе & Коворкинг CheckPoint — это пространство, где фрилансеры и другие люди могут провести время, работая, общаясь и реализуя свои идеи. В данном пространстве есть розетки, WiFi, стационарные ПК для работы, проекторы, экраны для презентаций, большие ТВ-мониторы для просмотра фильмов или показа презентаций и более 100 настолок. Также в данном пространстве есть вкусный чай, кофе и сладости. Кроме того, если вам мало сладостей и кофе с чаем вы можете сделать заказ из пиццерий или ресторанов.Что бы получить постоянную скидку вам стоит зарегистрироваться, это можно сделать в приложении.🌟","","","https://kowo-space.ru/wp-content/uploads/2023/10/xs.webp ; https://kowo-space.ru/wp-content/uploads/2023/10/xxxl-1-10.webp ; https://kowo-space.ru/wp-content/uploads/2023/10/xxxl-17.webp ; https://kowo-space.ru/wp-content/uploads/2023/10/xxxl-2-10.webp ; https://kowo-space.ru/wp-content/uploads/2023/10/xxxl-3-6.webp ; https://kowo-space.ru/wp-content/uploads/2023/10/xxxl-4-5.webp ; https://kowo-space.ru/wp-content/themes/dochernyaya-tema/includes/assets/img/deworkacy.png ; https://kowo-space.ru/wp-content/uploads/2023/11/1-300x94.webp"
"Библиотека-читальня им. А. С. Пушкина","https://kowo-space.ru/places/biblioteka-chitalnya-im-a-s-pushkina-2/","5","0","м. Бауманская (414 м), м. Красносельская (1,0 км)Адрес:ул. Спартаковская, 9Часы работы: вт-сб — 10:00-21:00, вск — 10:00-20:00","","https://yandex.ru/maps/org/gbuk_g_moskvy_biblioteka_chitalnya_im_a_s_pushkina/1016163978/","","+7 (499) 267-50-56","Библиотека-читальня имени А. С. Пушкина — это городская библиотека в Москве, расположенная в бывшей усадьбе Мухиных, построенной в начале XIX века.Пространство оборудовано игровыми комнатами, местами для коворкинга и работы за компьютером, а также залами для лекций, кинопросмотров, мастер-классов и творческих встреч. В фонде отдела представлена как классическая литература, так и книжные новинки. Также читателям предоставляется бесплатный доступ к электронным ресурсам НЭБ, EastView и «ЛитРес».Если вы фрилансер и хотите поработать в этой библиотеке, вы можете воспользоваться её ресурсами, участвовать в мероприятиях и наслаждаться атмосферой, насыщенной культурой и литературой.📚✨ | библиотека | гардероб или вешалка для одежды | звуковое оборудование | оборудование для конференц-залов | офисная техника | проектор и экран | розетки и зарядки | стационарные компьютеры | оплата онлайн или картой | книги | бесплатный Wi-Fi | близко к метро | красивый вид | тишина | Kowo рекомендует | Deworkacy Саввинский Коворкинг и офисы Большой Саввинский переулок, 8, стр. 1м. Спортивная, м. Киевская для резидентов доступ 24/710 000 ₽ / месяц | Забронировать | var myMap; | var objectManager; | var objectClicked = false; | // defer map load | if(document.readyState === 'ready' || document.readyState === 'complete') { | if (myMap == null) ymaps.ready(initMap); | else initMap(); | } else { | document.onreadystatechange = function () { | if (document.readyState == ""complete"") { | if (myMap == null) ymaps.ready(initMap); | else initMap(); | } | } | } | function initMap() { | myMap = new ymaps.Map(""map"", { center: [55.77202, 37.671959], zoom: 13, controls: [] }, {suppressMapOpenBlock: true}); | objectManager = new ymaps.ObjectManager({ clusterize: true, gridSize: 64 }); | objectManager.objects.options.set('preset', 'islands#greenDotIcon'); | objectManager.clusters.options.set('preset', 'islands#greenClusterIcons'); | objectManager.clusters.options.set('openBalloonOnClick', false); | myMap.geoObjects.add(objectManager); | objectManager.add({""type"": ""FeatureCollection"",""features"": [ | {""type"": ""Feature"", ""id"": 4609, ""geometry"": {""type"": ""Point"", ""coordinates"": [55.77202, 37.671959]}}			]}); | objectManager.objects.events.add('click', function (e) { | if ((objectManager.objects.getById(objectId) != 0) && !objectClicked) | { | var objectId = e.get('objectId'), | obj = objectManager.objects.getById(objectId); | if (hasBalloonData(objectId)) { | objectManager.objects.balloon.open(objectId); | } else { | objectClicked = true; | obj.properties = {}; | obj.properties.balloonContent = ""Загрузка...""; | objectManager.objects.balloon.open(objectId); | jQuery.get('https://kowo-space.ru/wp-admin/admin-ajax.php?action=messia_object_map_point&id=' + objectId.toString(), | function (data) { | obj.properties.balloonContent = data; | objectManager.objects.balloon.setData(obj); | objectClicked = false; | } | ); | } | } | }); | objectManager.clusters.events.add('click', function (e) { | if ((objectManager.clusters.getById(objectId) != 0) && !objectClicked) | { | var clusterId = e.get('objectId'), | cluster = objectManager.clusters.getById(clusterId); | var objectId = cluster.features[0].id, | obj = objectManager.objects.getById(objectId); | if (hasBalloonData(objectId)) { | objectManager.objects.balloon.open(objectId); | } else { | objectClicked = true; | obj.properties = {}; | obj.properties.balloonContent = ""Загрузка...""; | objectManager.objects.balloon.open(objectId); | jQuery.get('https://kowo-space.ru/wp-admin/admin-ajax.php?action=messia_object_map_point&id=' + objectId.toString(), | function (data) { | obj.properties.balloonContent = data; | objectManager.objects.balloon.setData(obj); | objectClicked = false; | } | ); | } | } | }); | } | function hasBalloonData (objectId) { | if (objectManager.objects.getById(objectId) != 0) | if (objectManager.objects.getById(objectId).properties) | return objectManager.objects.getById(objectId).properties.balloonContent; | return false; | } | X | Kowo рекомендует | Deworkacy Саввинский Коворкинг и офисы Большой Саввинский переулок, 8, стр. 1м. Спортивная, м. Киевская для резидентов доступ 24/710 000 ₽ / месяц | Забронировать | var myMap; | var objectManager; | var objectClicked = false; | // defer map load | if(document.readyState === 'ready' || document.readyState === 'complete') { | if (myMap == null) ymaps.ready(initMap); | else initMap(); | } else { | document.onreadystatechange = function () { | if (document.readyState == ""complete"") { | if (myMap == null) ymaps.ready(initMap); | else initMap(); | } | } | } | function initMap() { | myMap = new ymaps.Map(""map"", { center: [55.77202, 37.671959], zoom: 13, controls: [] }, {suppressMapOpenBlock: true}); | objectManager = new ymaps.ObjectManager({ clusterize: true, gridSize: 64 }); | objectManager.objects.options.set('preset', 'islands#greenDotIcon'); | objectManager.clusters.options.set('preset', 'islands#greenClusterIcons'); | objectManager.clusters.options.set('openBalloonOnClick', false); | myMap.geoObjects.add(objectManager); | objectManager.add({""type"": ""FeatureCollection"",""features"": [ | {""type"": ""Feature"", ""id"": 4609, ""geometry"": {""type"": ""Point"", ""coordinates"": [55.77202, 37.671959]}}			]}); | objectManager.objects.events.add('click', function (e) { | if ((objectManager.objects.getById(objectId) != 0) && !objectClicked) | { | var objectId = e.get('objectId'), | obj = objectManager.objects.getById(objectId); | if (hasBalloonData(objectId)) { | objectManager.objects.balloon.open(objectId); | } else { | objectClicked = true; | obj.properties = {}; | obj.properties.balloonContent = ""Загрузка...""; | objectManager.objects.balloon.open(objectId); | jQuery.get('https://kowo-space.ru/wp-admin/admin-ajax.php?action=messia_object_map_point&id=' + objectId.toString(), | function (data) { | obj.properties.balloonContent = data; | objectManager.objects.balloon.setData(obj); | objectClicked = false; | } | ); | } | } | }); | objectManager.clusters.events.add('click', function (e) { | if ((objectManager.clusters.getById(objectId) != 0) && !objectClicked) | { | var clusterId = e.get('objectId'), | cluster = objectManager.clusters.getById(clusterId); | var objectId = cluster.features[0].id, | obj = objectManager.objects.getById(objectId); | if (hasBalloonData(objectId)) { | objectManager.objects.balloon.open(objectId); | } else { | objectClicked = true; | obj.properties = {}; | obj.properties.balloonContent = ""Загрузка...""; | objectManager.objects.balloon.open(objectId); | jQuery.get('https://kowo-space.ru/wp-admin/admin-ajax.php?action=messia_object_map_point&id=' + objectId.toString(), | function (data) { | obj.properties.balloonContent = data; | objectManager.objects.balloon.setData(obj); | objectClicked = false; | } | ); | } | } | }); | } | function hasBalloonData (objectId) { | if (objectManager.objects.getById(objectId) != 0) | if (objectManager.objects.getById(objectId).properties) | return objectManager.objects.getById(objectId).properties.balloonContent; | return false; | }","","","https://kowo-space.ru/wp-content/uploads/2023/10/pushkina-1.png ; https://kowo-space.ru/wp-content/uploads/2023/10/s600xu_2x.webp ; https://kowo-space.ru/wp-content/uploads/2023/10/s600xu_2x-1.webp ; https://kowo-space.ru/wp-content/uploads/2023/10/16273867266.jpg ; https://kowo-space.ru/wp-content/uploads/2023/10/s600xu_2x-2.webp ; https://kowo-space.ru/wp-content/themes/dochernyaya-tema/includes/assets/img/deworkacy.png ; https://kowo-space.ru/wp-content/uploads/2023/11/1-300x94.webp"
"Бизнес-центр Деловой – Алексеевская Башня","https://kowo-space.ru/coworking/delovoj-vdnh/","4.2","0","м. ВДНХ (1,3 км), м. Ботанический сад (1,8 км)Адрес:Ракетный бульвар, д. 16, этаж 7Часы работы:пн-пт 10:00-19:00 сб-вс выходной","","https://yandex.ru/maps/org/delovoy/1396560617/","","+7 (495) 988-07-34","Бизнес-центр Деловой — этот центр предлагает готовые офисы с современным оснащением, трехэтажный подземный паркинг, кафе, фитнес-центр и магазины. Здание находится в парковой зоне и имеет удобный доступ к метро ВДНХ. Внутри бизнес-центра есть кафе, фитнес-центр, магазины и столовая, а также трехуровневая подземная парковка. Офисы предлагаются по системе «все включено», что означает, что в стоимость аренды входят мебель, интернет, коммунальные платежи, клининг и охрана. Дополнительно можно заказать услуги секретаря, курьера, IT-поддержку и юридическую помощь. | Плюсы: | Современное оборудование. | Удобное транспортное расположение. | Развитая инфраструктура. | Подходит для: | Средних и крупных компаний. | Малого бизнеса. | Профессионалов, ценящих удобство и функциональность.","Современное оборудование. ; Удобное транспортное расположение. ; Развитая инфраструктура. ; Подходит для: ; Средних и крупных компаний. ; Малого бизнеса. ; Профессионалов, ценящих удобство и функциональность. ; Деловой на карте Москвы — Яндекс Карты","","https://kowo-space.ru/wp-content/uploads/2024/02/xxxl-43-1.webp ; https://kowo-space.ru/wp-content/uploads/2024/02/xxxl-4-25-1.webp ; https://kowo-space.ru/wp-content/uploads/2024/02/xxxl-3-31-1.webp ; https://kowo-space.ru/wp-content/uploads/2024/02/xxxl-2-31-1.webp ; https://kowo-space.ru/wp-content/uploads/2024/02/xxxl-1-36-1.webp ; https://kowo-space.ru/wp-content/themes/dochernyaya-tema/includes/assets/img/deworkacy.png ; https://kowo-space.ru/wp-content/uploads/2023/11/1-300x94.webp"
"Бизнес-центр Деловой – Арма","https://kowo-space.ru/coworking/delovoj-nizhnij-susalnyj/","4.6","0","м. Курская (400 м), м. Чкаловская (576 м)Адрес:Нижний Сусальный пер., 5с19, этаж 3Часы работы:пн-пт 10:00-19:00 сб-вс выходной","","https://yandex.ru/maps/org/delovoy/1387412356/","","+7 (495) 988-07-31","Бизнес-центр Деловой - это многофункциональный деловой комплекс, предлагающий офисы, студии, шоу-румы, кафе, магазины и фитнес-центры. В стоимость аренды офисов включены мебель, безлимитный интернет, услуги секретаря, охрана, уборка и юридический адрес. Дополнительно можно заказать услуги курьера, IT-специалиста, HR и юриста. Бизнес-центр работает круглосуточно, обеспечивая удобство для компаний с любым графиком работы. Комплекс также предлагает почасовую аренду переговорных комнат, которые оснащены всем необходимым для проведения деловых встреч и мероприятий. На территории имеется охраняемая парковка, что делает его удобным для арендаторов и их гостей. | Плюсы: | Уникальный дизайн и стиль лофт. | Удобное расположение рядом с метро Курская. | Разнообразие офисных и творческих пространств. | Подходит для: | Творческих компаний и стартапов. | Малого и среднего бизнеса. | Организации выставок и мероприятий.","Уникальный дизайн и стиль лофт. ; Удобное расположение рядом с метро Курская. ; Разнообразие офисных и творческих пространств. ; Подходит для: ; Творческих компаний и стартапов. ; Малого и среднего бизнеса. ; Организации выставок и мероприятий. ; Деловой на карте Москвы — Яндекс Карты","","https://kowo-space.ru/wp-content/uploads/2024/02/xxxl-3-33-1.webp ; https://kowo-space.ru/wp-content/uploads/2024/02/xxxl-4-27-1.webp ; https://kowo-space.ru/wp-content/uploads/2024/02/xxxl-5-19-1.webp ; https://kowo-space.ru/wp-content/uploads/2024/02/xxxl-6-11-1.webp ; https://kowo-space.ru/wp-content/uploads/2024/02/xxxl-7-6-1.webp ; https://kowo-space.ru/wp-content/uploads/2024/02/xxxl-8-3-1.webp ; https://kowo-space.ru/wp-content/uploads/2024/02/xxxl-9-2-1.webp ; https://kowo-space.ru/wp-content/themes/dochernyaya-tema/includes/assets/img/deworkacy.png ; https://kowo-space.ru/wp-content/uploads/2023/11/1-300x94.webp"
"Бизнес-центр Деловой – Гостиный Двор","https://kowo-space.ru/coworking/delovoj-ilinka/","4.8","0","м. Площадь Революции (244 м), м. Лубянка (463 м)Адрес:ул. Ильинка, 4, подъезд 5, офис 2102, этаж 2Часы работы:пн-пт 10:00-19:00 сб-вс выходной","","https://yandex.ru/maps/org/delovoy/1337714089/","","+7 (495) 988-07-31","Бизнес-центр Деловой— это уникальное историческое здание в центре Москвы, построенное в 18 веке по проекту Джакомо Кваренги и реконструированное в 1995 году. БЦ сочетает в себе историческую атмосферу и современные бизнес-технологии. В нем находятся офисы, кафе, рестораны и салоны известных компаний. Гостиный Двор часто принимает мероприятия мирового уровня, включая шоу, концерты и выставки. Отличается удобным расположением рядом с Кремлем и метро. Также в стоимость аренды офисов включены мебель, безлимитный интернет, услуги секретаря, охрана, уборка и юридический адрес. Дополнительно можно заказать услуги курьера, IT-специалиста, HR и юриста. Бизнес-центр работает круглосуточно, обеспечивая удобство для компаний с любым графиком работы. | Плюсы: | Историческая и архитектурная значимость. | Современные офисные технологии. | Широкий спектр услуг и удобств. | Подходит для: | Крупных компаний и корпораций. | Организации мероприятий. | Бизнесменов, ценящих престиж и удобное расположение.","Историческая и архитектурная значимость. ; Современные офисные технологии. ; Широкий спектр услуг и удобств. ; Подходит для: ; Крупных компаний и корпораций. ; Организации мероприятий. ; Бизнесменов, ценящих престиж и удобное расположение. ; Деловой на карте Москвы — Яндекс Карты","","https://kowo-space.ru/wp-content/uploads/2024/02/xxxl-42-1.webp ; https://kowo-space.ru/wp-content/uploads/2024/02/xxxl-1-35-1.webp ; https://kowo-space.ru/wp-content/uploads/2024/02/xxxl-2-30-1.webp ; https://kowo-space.ru/wp-content/uploads/2024/02/xxxl-3-30-1.webp ; https://kowo-space.ru/wp-content/uploads/2024/02/xxxl-4-24-1.webp ; https://kowo-space.ru/wp-content/themes/dochernyaya-tema/includes/assets/img/deworkacy.png ; https://kowo-space.ru/wp-content/uploads/2023/11/1-300x94.webp"
